{
  "name": "amiga",
  "displayName": "Amiga Workbench",
  "mostLike": "light",
  "schemaVersion": 1,
  "colors": {
    "background": "hsl(209 100% 78%)",
    "foreground": "hsl(0 0% 0%)",
    "card": "hsl(209 100% 85%)",
    "cardForeground": "hsl(0 0% 0%)",
    "popover": "hsl(209 100% 85%)",
    "popoverForeground": "hsl(0 0% 0%)",
    "primary": "hsl(25 100% 50%)",
    "primaryForeground": "hsl(0 0% 0%)",
    "secondary": "hsl(0 0% 85%)",
    "secondaryForeground": "hsl(0 0% 0%)",
    "muted": "hsl(0 0% 90%)",
    "mutedForeground": "hsl(0 0% 30%)",
    "accent": "hsl(25 100% 50%)",
    "accentForeground": "hsl(0 0% 0%)",
    "destructive": "hsl(0 100% 50%)",
    "destructiveForeground": "hsl(0 0% 100%)",
    "border": "hsl(0 0% 0%)",
    "input": "hsl(0 0% 100%)",
    "ring": "hsl(25 100% 50%)"
  },
  "fonts": {
    "sans": "Topaz, Monaco, Courier, monospace",
    "serif": "Times, Times New Roman, serif",
    "mono": "Topaz, Monaco, Courier, monospace",
    "heading": "Topaz, Monaco, Courier, monospace",
    "body": "Topaz, Monaco, Courier, monospace"
  },
  "corners": {
    "none": "0px",
    "sm": "0px",
    "md": "0px",
    "lg": "0px",
    "xl": "0px",
    "full": "0px"
  },
  "shadows": {
    "none": "none",
    "sm": "inset -1px -1px 0 0 rgb(85 85 85), inset 1px 1px 0 0 rgb(255 255 255)",
    "md": "inset -2px -2px 0 0 rgb(85 85 85), inset 2px 2px 0 0 rgb(255 255 255)",
    "lg": "inset -2px -2px 0 0 rgb(85 85 85), inset 2px 2px 0 0 rgb(255 255 255)",
    "xl": "inset -3px -3px 0 0 rgb(85 85 85), inset 3px 3px 0 0 rgb(255 255 255)",
    "inner": "inset 1px 1px 0 0 rgb(85 85 85), inset -1px -1px 0 0 rgb(255 255 255)",
    "card": "inset -1px -1px 0 0 rgb(85 85 85), inset 1px 1px 0 0 rgb(255 255 255)",
    "button": "inset -1px -1px 0 0 rgb(85 85 85), inset 1px 1px 0 0 rgb(255 255 255)",
    "dropdown": "inset -1px -1px 0 0 rgb(85 85 85), inset 1px 1px 0 0 rgb(255 255 255)"
  },
  "tables": {
    "borderRadius": "0px"
  }
}
